{
  "api_version": "agent-platform/v1alpha1",
  "kind": "ToolCall",
  "metadata": {
    "id": "tcl_0198f6d0-7ef0-7b0e-a0d3-5f9c96c7f411",
    "revision": 1,
    "scope": {
      "type": "project",
      "tenant_id": "ten_0198f6d0-7ef0-7b0e-a0d3-5f9c96c7f411",
      "user_id": "usr_0198f6d0-7ef0-7b0e-a0d3-5f9c96c7f411",
      "project_id": "prj_0198f6d0-7ef0-7b0e-a0d3-5f9c96c7f411"
    },
    "labels": {},
    "annotations": {},
    "created_at": "2026-09-01T12:10:00Z",
    "created_by": {
      "actor_type": "agent",
      "actor_id": "agt_0198f6d0-7ef0-7b0e-a0d3-5f9c96c7f411"
    }
  },
  "spec": {
    "run_ref": {
      "kind": "AgentRun",
      "id": "run_0198f6d0-7ef0-7b0e-a0d3-5f9c96c7f411"
    },
    "tool_snapshot": {
      "tool_ref": {
        "kind": "ToolManifest",
        "id": "tol_0198f6d0-7ef0-7b0e-a0d3-5f9c96c7f411",
        "version": "1.0.0",
        "digest": "sha256:b2c3d4e5f6a1b2c3d4e5f6a1b2c3d4e5f6a1b2c3d4e5f6a1b2c3d4e5f6a1b2c3"
      },
      "side_effect": "read_only",
      "risk_level": "low"
    },
    "requested_by": {
      "actor_type": "agent",
      "actor_id": "agt_0198f6d0-7ef0-7b0e-a0d3-5f9c96c7f411"
    },
    "input": {
      "repository": "prj_demo",
      "path": "src/main.py",
      "action": "read"
    },
    "input_digest": "sha256:d4e5f6a1b2c3d4e5f6a1b2c3d4e5f6a1b2c3d4e5f61b2c3d4e5f6a1b2c3d4e5f",
    "permission_decision": {
      "decision": "allow",
      "policy_refs": [
        {
          "kind": "PermissionProfile",
          "id": "pep_0198f6d0-7ef0-7b0e-a0d3-5f9c96c7f411",
          "version": "1.0.0",
          "digest": "sha256:f6a1b2c3d4e5f6a1b2c3d4e5f6a1b2c3d4e5f6a1b2c3d4e5f6a1b2c3d4e5f6a1"
        }
      ],
      "reason_codes": ["RESOURCE_IN_PROJECT_SCOPE", "ACTION_ALLOWED"],
      "constraints": {
        "allowed_paths": ["src/**", "tests/**"]
      },
      "request_digest": "sha256:e5f6a1b2c3d4e5f6a1b2c3d4e5f6a1b2c3d4e5f6a1b2c3d4e5f6a1b2c3d4e5f6",
      "decision_digest": "sha256:f6a1b2c3d4e5f6a1b2c3d4e5f6a1b2c3d4e5f6a1b2c3d4e5f6a1b2c3d4e5f6a1"
    },
    "execution_target": "local",
    "attempt": 1,
    "output": {
      "content": "def main():\n    print('Hello, World!')\n",
      "encoding": "utf-8",
      "size_bytes": 42
    },
    "usage": {
      "duration_ms": 150
    }
  },
  "status": {
    "phase": "succeeded"
  }
}
